{
  "schema_version": "highambench-faithfulness-0.1",
  "role": "blind-translation",
  "dossier_sha256": "14f2c51b532ef14475c45374db729456457f7bfb122cb4c92ac52b237510b1c8",
  "dependency_coverage": [
    {
      "id": "D001",
      "name": "LocalDef001",
      "meaning": "For real u and natural n, this is the strict validity condition n*u < 1, where n is cast exactly to a real.",
      "effect_on_target": "The sole explicit premise is (2^r - 1)*u < 1. It ensures that the denominator of gamma_(2^r-1)(u) is positive.",
      "status": "understood"
    },
    {
      "id": "D002",
      "name": "LocalDef002",
      "meaning": "An inductive package for a real error parameter u and a binary real operation fl_add, together with the properties supplied by constructor D008.",
      "effect_on_target": "The target universally quantifies over such a package and extracts its u and fl_add fields.",
      "status": "understood"
    },
    {
      "id": "D003",
      "name": "LocalDef003",
      "meaning": "The projection fp.3, namely the packaged binary operation fl_add : Real -> Real -> Real.",
      "effect_on_target": "This operation is used at every internal node of both computed summation algorithms.",
      "status": "understood"
    },
    {
      "id": "D004",
      "name": "LocalDef004",
      "meaning": "The projection fp.1, namely the packaged real error parameter u.",
      "effect_on_target": "It occurs in the validity premise and in every gamma constant.",
      "status": "understood"
    },
    {
      "id": "D005",
      "name": "LocalDef005",
      "meaning": "For real u and natural n, it defines gamma_n(u) = (n*u)/(1 - n*u), with n cast to a real.",
      "effect_on_target": "It supplies gamma_r(u), gamma_(2^r-1)(u), and the final comparison between these constants.",
      "status": "understood"
    },
    {
      "id": "D006",
      "name": "LocalDef006",
      "meaning": "A balanced binary summation of exactly 2^r entries. At r=0 it returns v_0. At r=s+1 it recursively sums the first and second blocks of 2^s entries and applies fl_add to the two results.",
      "effect_on_target": "Its result P_r(v) is the computed quantity in the first forward-error inequality.",
      "status": "understood"
    },
    {
      "id": "D007",
      "name": "LocalDef007",
      "meaning": "A sequential left-to-right summation of n entries: Q_0=0, Q_1(v)=v_0, and Q_(k+1)(v)=fl_add(Q_k(v_0,...,v_(k-1)),v_k) for k>=1.",
      "effect_on_target": "It is applied with n=2^r and supplies the computed quantity in the second forward-error inequality.",
      "status": "understood"
    },
    {
      "id": "D008",
      "name": "LocalDef008",
      "meaning": "The constructor packages u with 0 <= u, an operation fl_add satisfying fl_add(0,x)=x, and the model that for every real x,y there exists a real delta, possibly depending on x and y, such that |delta| <= u and fl_add(x,y)=(x+y)*(1+delta).",
      "effect_on_target": "These are the implicit model assumptions attached to every quantified fp and are what constrain the two computed sums.",
      "status": "understood"
    },
    {
      "id": "D009",
      "name": "LocalDef009",
      "meaning": "It embeds an index i<2^r into the first half of an index set of size 2^(r+1), preserving the value i.",
      "effect_on_target": "It selects the first half of the vector in each balanced-summation recursion step.",
      "status": "understood"
    },
    {
      "id": "D010",
      "name": "LocalDef010",
      "meaning": "A proof that 0 < 2^0, equivalently 0 < 1.",
      "effect_on_target": "It justifies the index 0 used in the base case of balanced summation and has no additional numerical content.",
      "status": "understood"
    },
    {
      "id": "D011",
      "name": "LocalDef011",
      "meaning": "A dependent natural-number case splitter specialized to vectors of length 2^x, with cases x=0 and x=r+1.",
      "effect_on_target": "It implements the base and recursive branches of balanced summation without adding a mathematical assumption.",
      "status": "understood"
    },
    {
      "id": "D012",
      "name": "LocalDef012",
      "meaning": "It proves that if n=0 then 0<n+1.",
      "effect_on_target": "It justifies selecting v_0 in the one-element branch of sequential summation and has no numerical effect.",
      "status": "understood"
    },
    {
      "id": "D013",
      "name": "LocalDef013",
      "meaning": "A dependent natural-number case splitter for vectors of length x, with cases x=0 and x=n+1.",
      "effect_on_target": "It implements the empty and nonempty branches of sequential summation.",
      "status": "understood"
    },
    {
      "id": "D014",
      "name": "LocalDef014",
      "meaning": "It embeds i<2^r into the second half of an index set of size 2^(r+1), mapping i to i+2^r.",
      "effect_on_target": "It selects the second half of the vector in each balanced-summation recursion step.",
      "status": "understood"
    },
    {
      "id": "D015",
      "name": "LocalDef015",
      "meaning": "It proves i<2^(r+1) whenever i<2^r.",
      "effect_on_target": "It supplies the bound proof for the first-half embedding D009.",
      "status": "understood"
    },
    {
      "id": "D016",
      "name": "LocalDef016",
      "meaning": "It proves i+2^r<2^(r+1) whenever i<2^r.",
      "effect_on_target": "It supplies the bound proof for the second-half embedding D014.",
      "status": "understood"
    },
    {
      "id": "D017",
      "name": "And",
      "meaning": "Logical conjunction.",
      "effect_on_target": "The conclusion has the exact nesting A and (B and C), so all three asserted inequalities must hold.",
      "status": "understood"
    },
    {
      "id": "D018",
      "name": "Fin",
      "meaning": "Fin n is the finite index type consisting of natural values i with i<n.",
      "effect_on_target": "It makes v a vector with exactly 2^r entries and supplies the index types used by both recursions.",
      "status": "understood"
    },
    {
      "id": "D019",
      "name": "Fin.fintype",
      "meaning": "The canonical finite enumeration of all elements of Fin n.",
      "effect_on_target": "It enables summation over every vector index.",
      "status": "understood"
    },
    {
      "id": "D020",
      "name": "Finset.sum",
      "meaning": "Finite summation in an additive commutative monoid.",
      "effect_on_target": "It forms the exact real sum of the entries and the exact sum of their absolute values.",
      "status": "understood"
    },
    {
      "id": "D021",
      "name": "Finset.univ",
      "meaning": "The finite set containing every element of a finite type.",
      "effect_on_target": "It makes both target sums range over all i in Fin(2^r).",
      "status": "understood"
    },
    {
      "id": "D022",
      "name": "HMul.hMul",
      "meaning": "The overloaded multiplication operation selected by a multiplication instance.",
      "effect_on_target": "For reals it denotes ordinary multiplication in gamma constants, model equations, and error-bound right-hand sides.",
      "status": "understood"
    },
    {
      "id": "D023",
      "name": "HPow.hPow",
      "meaning": "The overloaded exponentiation operation.",
      "effect_on_target": "With natural base 2 and natural exponent r, it denotes the natural number 2^r.",
      "status": "understood"
    },
    {
      "id": "D024",
      "name": "HSub.hSub",
      "meaning": "The overloaded subtraction operation.",
      "effect_on_target": "It denotes real subtraction in errors and gamma denominators, and truncated natural subtraction in 2^r-1.",
      "status": "understood"
    },
    {
      "id": "D025",
      "name": "LE.le",
      "meaning": "The non-strict order relation supplied by an LE instance.",
      "effect_on_target": "For reals it expresses the three asserted inequalities and the bounds 0<=u and |delta|<=u.",
      "status": "understood"
    },
    {
      "id": "D026",
      "name": "Monoid.toNatPow",
      "meaning": "It derives natural-number exponentiation from a monoid's repeated multiplication.",
      "effect_on_target": "Together with the natural multiplicative monoid, it gives the ordinary power 2^r.",
      "status": "understood"
    },
    {
      "id": "D027",
      "name": "Nat",
      "meaning": "The type of natural numbers, including zero.",
      "effect_on_target": "It is the domain of r, vector dimensions, recursion depths, indices, and gamma subscripts.",
      "status": "understood"
    },
    {
      "id": "D028",
      "name": "Nat.instMonoid",
      "meaning": "The standard multiplicative monoid structure on natural numbers.",
      "effect_on_target": "It makes the power expression in the vector dimension equal to ordinary natural exponentiation.",
      "status": "understood"
    },
    {
      "id": "D029",
      "name": "OfNat.ofNat",
      "meaning": "Interpretation of a numeral in a specified type.",
      "effect_on_target": "It supplies the natural numerals 0, 1, and 2 and the corresponding real numerals where required.",
      "status": "understood"
    },
    {
      "id": "D030",
      "name": "Real",
      "meaning": "The type of real numbers.",
      "effect_on_target": "Vector entries, computed sums, exact sums, u, delta, gamma constants, and error bounds are all real-valued.",
      "status": "understood"
    },
    {
      "id": "D031",
      "name": "Real.instAddCommMonoid",
      "meaning": "The standard additive commutative monoid structure on the reals.",
      "effect_on_target": "It gives the exact finite sums their ordinary order-independent real-addition meaning.",
      "status": "understood"
    },
    {
      "id": "D032",
      "name": "Real.instAddGroup",
      "meaning": "The standard additive group structure on the reals.",
      "effect_on_target": "It supports negation, subtraction, and the absolute-value definition used in the error expressions.",
      "status": "understood"
    },
    {